{
  "format": "cuicui.preset",
  "version": 1,
  "name": "Chatty",
  "category": "Character",
  "author": "Cuicui Instruments",
  "description": "A busy bird: hardly any pause, and the syllables in shuffled order.",
  "voice_bank": "hf_22938+hf_22937",
  "parameters": {
    "perf.pause_s": 0.1,
    "perf.order": "Shuffled"
  }
}
