{
  "format": "cuicui.preset",
  "version": 1,
  "name": "Solo bird",
  "category": "Flock",
  "author": "Cuicui Instruments",
  "description": "One bird in the middle: each new key takes over from the last. For melodies.",
  "voice_bank": "hf_22938+hf_22937",
  "parameters": {
    "perf.polyphony": 1,
    "out.stereo_spread": 0.0
  }
}
