{
  "format": "cuicui.preset",
  "version": 1,
  "name": "Finch, follow the keyboard",
  "category": "Finch",
  "author": "Cuicui Instruments",
  "description": "The bird sings three octaves above your key, so tunes keep their shape. Best between C4 and C6.",
  "voice_bank": "zf_22938",
  "parameters": {
    "perf.mapping": "Follow the keyboard"
  }
}
